
ffff9f9f6edd4240 898834498 S Io:2:005:1 -115:1 64 = 00a20005 00000000 00000000 00000000 00000000 00000000 00000000 00000000
ffff9f9f6edd4240 898835229 C Io:2:005:1 0:1 64 >
ffff9f9f72776480 898859236 C Ii:2:005:1 0:1 64 = 1f001e00 21002300 00000000 00000000 00000000 00000000 00000000 00000000
ffff9f9f46c58540 898859450 S Ii:2:005:1 -115:1 64 <
ffff9f9f6edd4b40 898976736 S Io:2:005:1 -115:1 64 = 00a20005 00000000 00000000 00000000 00000000 00000000 00000000 00000000
ffff9f9f6edd4b40 898978224 C Io:2:005:1 0:1 64 >
ffff9f9f46c58540 899002245 C Ii:2:005:1 0:1 64 = 33003000 32008301 00000000 00000000 00000000 00000000 00000000 00000000
ffff9f9f709b23c0 899004428 S Ii:2:005:1 -115:1 64 <
ffff9f9f709b20c0 899119670 S Io:2:005:1 -115:1 64 = 00a20005 00000000 00000000 00000000 00000000 00000000 00000000 00000000
ffff9f9f709b20c0 899121246 C Io:2:005:1 0:1 64 >
ffff9f9f709b23c0 899145264 C Ii:2:005:1 0:1 64 = 43003f00 4300b702 00000000 00000000 00000000 00000000 00000000 00000000
ffff9f9f6aca4300 899147115 S Ii:2:005:1 -115:1 64 <
ffff9f9f6edd4b40 899261986 S Io:2:005:1 -115:1 64 = 00a20005 00000000 00000000 00000000 00000000 00000000 00000000 00000000
ffff9f9f6edd4b40 899263243 C Io:2:005:1 0:1 64 >
ffff9f9f6aca4300 899287252 C Ii:2:005:1 0:1 64 = 55005000 5400be03 00000000 00000000 00000000 00000000 00000000 00000000
ffff9f9f6edd4240 899289570 S Ii:2:005:1 -115:1 64 <
ffff9f9f46c58a80 899384825 S Io:2:005:1 -115:1 64 = 00a20005 00000000 00000000 00000000 00000000 00000000 00000000 00000000
ffff9f9f46c58a80 899386243 C Io:2:005:1 0:1 64 >
ffff9f9f6edd4240 899410218 C Ii:2:005:1 0:1 64 = 65006300 64008104 00000000 00000000 00000000 00000000 00000000 00000000
ffff9f9f6edd4f00 899412450 S Ii:2:005:1 -115:1 64 <
ffff9f9f6edd46c0 899530839 S Io:2:005:1 -115:1 64 = 00a20005 00000000 00000000 00000000 00000000 00000000 00000000 00000000
ffff9f9f6edd46c0 899532260 C Io:2:005:1 0:1 64 >
ffff9f9f6edd4f00 899556257 C Ii:2:005:1 0:1 64 = 75007200 75005605 00000000 00000000 00000000 00000000 00000000 00000000
ffff9f9f6edd4540 899558624 S Ii:2:005:1 -115:1 64 <
ffff9f9f6aca4cc0 899673875 S Io:2:005:1 -115:1 64 = 00a20005 00000000 00000000 00000000 00000000 00000000 00000000 00000000
ffff9f9f6aca4cc0 899675219 C Io:2:005:1 0:1 64 >
ffff9f9f6edd4540 899699221 C Ii:2:005:1 0:1 64 = 86008600 85000a06 00000000 00000000 00000000 00000000 00000000 00000000
ffff9f9f709b23c0 899699489 S Ii:2:005:1 -115:1 64 <
ffff9f9f709b2300 899834893 S Io:2:005:1 -115:1 64 = 00a20005 00000000 00000000 00000000 00000000 00000000 00000000 00000000
ffff9f9f709b2300 899836220 C Io:2:005:1 0:1 64 >
ffff9f9f709b23c0 899860218 C Ii:2:005:1 0:1 64 = 98009500 9400bf06 00000000 00000000 00000000 00000000 00000000 00000000
ffff9f9f6aca4cc0 899862557 S Ii:2:005:1 -115:1 64 <
ffff9f9f6edd4540 899977713 S Io:2:005:1 -115:1 64 = 00a20005 00000000 00000000 00000000 00000000 00000000 00000000 00000000
ffff9f9f6edd4540 899979265 C Io:2:005:1 0:1 64 >
ffff9f9f6aca4cc0 900003272 C Ii:2:005:1 0:1 64 = a800a500 a4004b07 00000000 00000000 00000000 00000000 00000000 00000000
ffff9f9f6edd4f00 900005118 S Ii:2:005:1 -115:1 64 <
ffff9f9f6edd46c0 900123685 S Io:2:005:1 -115:1 64 = 00a20005 00000000 00000000 00000000 00000000 00000000 00000000 00000000
ffff9f9f6edd46c0 900125232 C Io:2:005:1 0:1 64 >
ffff9f9f6edd4f00 900149200 C Ii:2:005:1 0:1 64 = b800b300 b400c807 00000000 00000000 00000000 00000000 00000000 00000000
ffff9f9f46c58c00 900151493 S Ii:2:005:1 -115:1 64 <
ffff9f9f6edd4240 900266674 S Io:2:005:1 -115:1 64 = 00a20005 00000000 00000000 00000000 00000000 00000000 00000000 00000000
ffff9f9f6edd4240 900268274 C Io:2:005:1 0:1 64 >
ffff9f9f46c58c00 900292268 C Ii:2:005:1 0:1 64 = c700c400 c4003608 00000000 00000000 00000000 00000000 00000000 00000000
ffff9f9f6aca4cc0 900294328 S Ii:2:005:1 -115:1 64 <
ffff9f9f6edd4b40 900409880 S Io:2:005:1 -115:1 64 = 00a20005 00000000 00000000 00000000 00000000 00000000 00000000 00000000
ffff9f9f6edd4b40 900411224 C Io:2:005:1 0:1 64 >
ffff9f9f6aca4cc0 900435243 C Ii:2:005:1 0:1 64 = d500d300 d4009608 00000000 00000000 00000000 00000000 00000000 00000000
ffff9f9f6edd4b40 900437537 S Ii:2:005:1 -115:1 64 <
ffff9f9f6edd4240 900552718 S Io:2:005:1 -115:1 64 = 00a20005 00000000 00000000 00000000 00000000 00000000 00000000 00000000
ffff9f9f6edd4240 900554236 C Io:2:005:1 0:1 64 >
ffff9f9f6edd4b40 900578302 C Ii:2:005:1 0:1 64 = e700e200 e300ed08 00000000 00000000 00000000 00000000 00000000 00000000
ffff9f9f6edd4f00 900580695 S Ii:2:005:1 -115:1 64 <
ffff9f9f6aca4300 900695767 S Io:2:005:1 -115:1 64 = 00a20005 00000000 00000000 00000000 00000000 00000000 00000000 00000000
ffff9f9f6aca4300 900697279 C Io:2:005:1 0:1 64 >
ffff9f9f6edd4f00 900721283 C Ii:2:005:1 0:1 64 = f700ef00 f1003b09 00000000 00000000 00000000 00000000 00000000 00000000
ffff9f9f709b2300 900721510 S Ii:2:005:1 -115:1 64 <
ffff9f9f709b23c0 900838000 S Io:2:005:1 -115:1 64 = 00a20005 00000000 00000000 00000000 00000000 00000000 00000000 00000000
ffff9f9f709b23c0 900839245 C Io:2:005:1 0:1 64 >
ffff9f9f709b2300 900863300 C Ii:2:005:1 0:1 64 = 0401fd00 01017e09 00000000 00000000 00000000 00000000 00000000 00000000
ffff9f9f709b2300 900863537 S Ii:2:005:1 -115:1 64 <
ffff9f9f6edd46c0 900980202 S Io:2:005:1 -115:1 64 = 00a20005 00000000 00000000 00000000 00000000 00000000 00000000 00000000
ffff9f9f6edd46c0 900981245 C Io:2:005:1 0:1 64 >
ffff9f9f709b2300 901005202 C Ii:2:005:1 0:1 64 = 13010e01 1001bc09 00000000 00000000 00000000 00000000 00000000 00000000
ffff9f9f709b2300 901005388 S Ii:2:005:1 -115:1 64 <
ffff9f9f709b23c0 901121271 S Io:2:005:1 -115:1 64 = 00a20005 00000000 00000000 00000000 00000000 00000000 00000000 00000000
ffff9f9f709b23c0 901122264 C Io:2:005:1 0:1 64 >
ffff9f9f709b2300 901146281 C Ii:2:005:1 0:1 64 = 22011d01 1e01f209 00000000 00000000 00000000 00000000 00000000 00000000
ffff9f9f6aca46c0 901146622 S Ii:2:005:1 -115:1 64 <
ffff9f9f6edd4540 901244987 S Io:2:005:1 -115:1 64 = 00a20005 00000000 00000000 00000000 00000000 00000000 00000000 00000000
ffff9f9f6edd4540 901246232 C Io:2:005:1 0:1 64 >
ffff9f9f6aca46c0 901270272 C Ii:2:005:1 0:1 64 = 31012b01 2e011a0a 00000000 00000000 00000000 00000000 00000000 00000000
ffff9f9f6aca46c0 901270615 S Ii:2:005:1 -115:1 64 <
ffff9f9f6aca4780 901385810 S Io:2:005:1 -115:1 64 = 00a20005 00000000 00000000 00000000 00000000 00000000 00000000 00000000
ffff9f9f6aca4780 901387245 C Io:2:005:1 0:1 64 >
ffff9f9f6aca46c0 901411210 C Ii:2:005:1 0:1 64 = 43013801 3b01450a 00000000 00000000 00000000 00000000 00000000 00000000
ffff9f9f6edd4540 901413487 S Ii:2:005:1 -115:1 64 <
ffff9f9f709b2000 901530428 S Io:2:005:1 -115:1 64 = 00a20005 00000000 00000000 00000000 00000000 00000000 00000000 00000000
ffff9f9f709b2000 901531269 C Io:2:005:1 0:1 64 >
ffff9f9f6edd4540 901555307 C Ii:2:005:1 0:1 64 = 50014701 4d016c0a 00000000 00000000 00000000 00000000 00000000 00000000
ffff9f9f6aca46c0 901555574 S Ii:2:005:1 -115:1 64 <
ffff9f9f709b20c0 901670793 S Io:2:005:1 -115:1 64 = 00a20005 00000000 00000000 00000000 00000000 00000000 00000000 00000000
ffff9f9f709b20c0 901672274 C Io:2:005:1 0:1 64 >
ffff9f9f6aca46c0 901696290 C Ii:2:005:1 0:1 64 = 60015501 5c018f0a 00000000 00000000 00000000 00000000 00000000 00000000
ffff9f9f46c580c0 901698662 S Ii:2:005:1 -115:1 64 <
ffff9f9f6edd46c0 901813782 S Io:2:005:1 -115:1 64 = 00a20005 00000000 00000000 00000000 00000000 00000000 00000000 00000000
ffff9f9f6edd46c0 901815285 C Io:2:005:1 0:1 64 >
ffff9f9f46c580c0 901839247 C Ii:2:005:1 0:1 64 = 70016101 6b01b00a 00000000 00000000 00000000 00000000 00000000 00000000
ffff9f9f709b2540 901841398 S Ii:2:005:1 -115:1 64 <
ffff9f9f6aca46c0 901956496 S Io:2:005:1 -115:1 64 = 00a20005 00000000 00000000 00000000 00000000 00000000 00000000 00000000
ffff9f9f6aca46c0 901957254 C Io:2:005:1 0:1 64 >
ffff9f9f709b2540 901981271 C Ii:2:005:1 0:1 64 = 7f016f01 7901ce0a 00000000 00000000 00000000 00000000 00000000 00000000
ffff9f9f6aca46c0 901981602 S Ii:2:005:1 -115:1 64 <
ffff9f9f709b20c0 902096320 S Io:2:005:1 -115:1 64 = 00a20005 00000000 00000000 00000000 00000000 00000000 00000000 00000000
ffff9f9f709b20c0 902097275 C Io:2:005:1 0:1 64 >
ffff9f9f6aca46c0 902121277 C Ii:2:005:1 0:1 64 = 8d017c01 8701e70a 00000000 00000000 00000000 00000000 00000000 00000000
ffff9f9f6aca46c0 902121603 S Ii:2:005:1 -115:1 64 <
ffff9f9f6aca4780 902232924 S Io:2:005:1 -115:1 64 = 00a20005 00000000 00000000 00000000 00000000 00000000 00000000 00000000
ffff9f9f6aca4780 902234291 C Io:2:005:1 0:1 64 >
ffff9f9f6aca46c0 902258281 C Ii:2:005:1 0:1 64 = 9b018a01 9601fd0a 00000000 00000000 00000000 00000000 00000000 00000000
ffff9f9f46c586c0 902260604 S Ii:2:005:1 -115:1 64 <
ffff9f9f6aca46c0 902376124 S Io:2:005:1 -115:1 64 = 00a20005 00000000 00000000 00000000 00000000 00000000 00000000 00000000
ffff9f9f6aca46c0 902377274 C Io:2:005:1 0:1 64 >
ffff9f9f46c586c0 902401267 C Ii:2:005:1 0:1 64 = a8019701 a401110b 00000000 00000000 00000000 00000000 00000000 00000000
ffff9f9f6aca46c0 902401598 S Ii:2:005:1 -115:1 64 <
ffff9f9f46c583c0 902517719 S Io:2:005:1 -115:1 64 = 00a20005 00000000 00000000 00000000 00000000 00000000 00000000 00000000
ffff9f9f46c583c0 902519298 C Io:2:005:1 0:1 64 >
ffff9f9f6aca46c0 902543278 C Ii:2:005:1 0:1 64 = ba01a501 b201240b 00000000 00000000 00000000 00000000 00000000 00000000
ffff9f9f46c58780 902545493 S Ii:2:005:1 -115:1 64 <
ffff9f9f6aca46c0 902660810 S Io:2:005:1 -115:1 64 = 00a20005 00000000 00000000 00000000 00000000 00000000 00000000 00000000
ffff9f9f6aca46c0 902662238 C Io:2:005:1 0:1 64 >
ffff9f9f46c58780 902686290 C Ii:2:005:1 0:1 64 = c701b101 c001330b 00000000 00000000 00000000 00000000 00000000 00000000
ffff9f9f6aca46c0 902688229 S Ii:2:005:1 -115:1 64 <
ffff9f9f6edd4f00 902803887 S Io:2:005:1 -115:1 64 = 00a20005 00000000 00000000 00000000 00000000 00000000 00000000 00000000
ffff9f9f6edd4f00 902805250 C Io:2:005:1 0:1 64 >
ffff9f9f6aca46c0 902829288 C Ii:2:005:1 0:1 64 = d501be01 cf01410b 00000000 00000000 00000000 00000000 00000000 00000000
ffff9f9f6aca46c0 902831342 S Ii:2:005:1 -115:1 64 <
ffff9f9f6edd4b40 902946709 S Io:2:005:1 -115:1 64 = 00a20005 00000000 00000000 00000000 00000000 00000000 00000000 00000000
ffff9f9f6edd4b40 902948296 C Io:2:005:1 0:1 64 >
ffff9f9f6aca46c0 902972284 C Ii:2:005:1 0:1 64 = e201ca01 de014f0b 00000000 00000000 00000000 00000000 00000000 00000000
ffff9f9f46c583c0 902974202 S Ii:2:005:1 -115:1 64 <
ffff9f9f6aca46c0 903089312 S Io:2:005:1 -115:1 64 = 00a20005 00000000 00000000 00000000 00000000 00000000 00000000 00000000
ffff9f9f6aca46c0 903090242 C Io:2:005:1 0:1 64 >
ffff9f9f46c583c0 903114323 C Ii:2:005:1 0:1 64 = f101d801 ec015d0b 00000000 00000000 00000000 00000000 00000000 00000000
ffff9f9f709b2000 903114596 S Ii:2:005:1 -115:1 64 <
ffff9f9f46c58900 903229616 S Io:2:005:1 -115:1 64 = 00a20005 00000000 00000000 00000000 00000000 00000000 00000000 00000000
ffff9f9f46c58900 903230308 C Io:2:005:1 0:1 64 >
ffff9f9f709b2000 903254305 C Ii:2:005:1 0:1 64 = 0002e701 f901670b 00000000 00000000 00000000 00000000 00000000 00000000
ffff9f9f709b2000 903254587 S Ii:2:005:1 -115:1 64 <
ffff9f9f6aca4780 903370799 S Io:2:005:1 -115:1 64 = 00a20005 00000000 00000000 00000000 00000000 00000000 00000000 00000000
ffff9f9f6aca4780 903372307 C Io:2:005:1 0:1 64 >
ffff9f9f709b2000 903396307 C Ii:2:005:1 0:1 64 = 0d02f301 0702710b 00000000 00000000 00000000 00000000 00000000 00000000
ffff9f9f709b2000 903396541 S Ii:2:005:1 -115:1 64 <
ffff9f9f46c580c0 903512807 S Io:2:005:1 -115:1 64 = 00a20005 00000000 00000000 00000000 00000000 00000000 00000000 00000000
ffff9f9f46c580c0 903514306 C Io:2:005:1 0:1 64 >
ffff9f9f709b2000 903538309 C Ii:2:005:1 0:1 64 = 19020002 14027c0b 00000000 00000000 00000000 00000000 00000000 00000000
ffff9f9f709b2300 903540563 S Ii:2:005:1 -115:1 64 <
ffff9f9f709b23c0 903676265 S Io:2:005:1 -115:1 64 = 00a20005 00000000 00000000 00000000 00000000 00000000 00000000 00000000
ffff9f9f709b23c0 903677242 C Io:2:005:1 0:1 64 >
ffff9f9f709b2300 903701311 C Ii:2:005:1 0:1 64 = 26020b02 2102870b 00000000 00000000 00000000 00000000 00000000 00000000
ffff9f9f6aca4900 903701597 S Ii:2:005:1 -115:1 64 <
ffff9f9f46c58000 903817187 S Io:2:005:1 -115:1 64 = 00a20005 00000000 00000000 00000000 00000000 00000000 00000000 00000000
ffff9f9f46c58000 903818304 C Io:2:005:1 0:1 64 >
ffff9f9f6aca4900 903842295 C Ii:2:005:1 0:1 64 = 33021802 31028e0b 00000000 00000000 00000000 00000000 00000000 00000000
ffff9f9f6aca4900 903842516 S Ii:2:005:1 -115:1 64 <
ffff9f9f46c58c00 903957954 S Io:2:005:1 -115:1 64 = 00a20005 00000000 00000000 00000000 00000000 00000000 00000000 00000000
ffff9f9f46c58c00 903959310 C Io:2:005:1 0:1 64 >
ffff9f9f6aca4900 903983316 C Ii:2:005:1 0:1 64 = 40022402 3d02960b 00000000 00000000 00000000 00000000 00000000 00000000
ffff9f9f6aca4900 903983575 S Ii:2:005:1 -115:1 64 <
ffff9f9f709b23c0 904100116 S Io:2:005:1 -115:1 64 = 00a20005 00000000 00000000 00000000 00000000 00000000 00000000 00000000
ffff9f9f709b23c0 904101299 C Io:2:005:1 0:1 64 >
ffff9f9f6aca4900 904125337 C Ii:2:005:1 0:1 64 = 4d023002 4b029c0b 00000000 00000000 00000000 00000000 00000000 00000000
ffff9f9f6aca4900 904125594 S Ii:2:005:1 -115:1 64 <
ffff9f9f709b2000 904262096 S Io:2:005:1 -115:1 64 = 00a20005 00000000 00000000 00000000 00000000 00000000 00000000 00000000
ffff9f9f709b2000 904263248 C Io:2:005:1 0:1 64 >
ffff9f9f6aca4900 904287302 C Ii:2:005:1 0:1 64 = 5c023d02 5802a30b 00000000 00000000 00000000 00000000 00000000 00000000
ffff9f9f6aca4900 904287556 S Ii:2:005:1 -115:1 64 <
ffff9f9f709b20c0 904404180 S Io:2:005:1 -115:1 64 = 00a20005 00000000 00000000 00000000 00000000 00000000 00000000 00000000
ffff9f9f709b20c0 904405295 C Io:2:005:1 0:1 64 >
ffff9f9f6aca4900 904429319 C Ii:2:005:1 0:1 64 = 68024702 6502aa0b 00000000 00000000 00000000 00000000 00000000 00000000
ffff9f9f6aca4900 904429599 S Ii:2:005:1 -115:1 64 <
ffff9f9f46c58a80 904526226 S Io:2:005:1 -115:1 64 = 00a20005 00000000 00000000 00000000 00000000 00000000 00000000 00000000
ffff9f9f46c58a80 904527309 C Io:2:005:1 0:1 64 >
ffff9f9f6aca4900 904551321 C Ii:2:005:1 0:1 64 = 76025302 7202ae0b 00000000 00000000 00000000 00000000 00000000 00000000
ffff9f9f6aca4900 904551652 S Ii:2:005:1 -115:1 64 <
ffff9f9f6aca4c00 904668254 S Io:2:005:1 -115:1 64 = 00a20005 00000000 00000000 00000000 00000000 00000000 00000000 00000000
ffff9f9f6aca4c00 904669299 C Io:2:005:1 0:1 64 >
ffff9f9f6aca4900 904693321 C Ii:2:005:1 0:1 64 = 83026002 7e02b30b 00000000 00000000 00000000 00000000 00000000 00000000
ffff9f9f46c58540 904695696 S Ii:2:005:1 -115:1 64 <
ffff9f9f6aca4900 904810842 S Io:2:005:1 -115:1 64 = 00a20005 00000000 00000000 00000000 00000000 00000000 00000000 00000000
ffff9f9f6aca4900 904812320 C Io:2:005:1 0:1 64 >
ffff9f9f46c58540 904836261 C Ii:2:005:1 0:1 64 = 91026b02 8d02b50b 00000000 00000000 00000000 00000000 00000000 00000000
ffff9f9f6aca4900 904836524 S Ii:2:005:1 -115:1 64 <
ffff9f9f6aca4c00 904972588 S Io:2:005:1 -115:1 64 = 00a20005 00000000 00000000 00000000 00000000 00000000 00000000 00000000
ffff9f9f6aca4c00 904973270 C Io:2:005:1 0:1 64 >
ffff9f9f6aca4900 904997272 C Ii:2:005:1 0:1 64 = 9c027702 9a02b90b 00000000 00000000 00000000 00000000 00000000 00000000
ffff9f9f46c58cc0 904997518 S Ii:2:005:1 -115:1 64 <
ffff9f9f6aca4c00 905112576 S Io:2:005:1 -115:1 64 = 00a20005 00000000 00000000 00000000 00000000 00000000 00000000 00000000
ffff9f9f6aca4c00 905113273 C Io:2:005:1 0:1 64 >
ffff9f9f46c58cc0 905137295 C Ii:2:005:1 0:1 64 = a8028502 a702bb0b 00000000 00000000 00000000 00000000 00000000 00000000
ffff9f9f46c58cc0 905137587 S Ii:2:005:1 -115:1 64 <
ffff9f9f6aca4480 905274059 S Io:2:005:1 -115:1 64 = 00a20005 00000000 00000000 00000000 00000000 00000000 00000000 00000000
ffff9f9f6aca4480 905275249 C Io:2:005:1 0:1 64 >
ffff9f9f46c58cc0 905299268 C Ii:2:005:1 0:1 64 = b4029202 b202be0b 00000000 00000000 00000000 00000000 00000000 00000000
ffff9f9f709b2540 905299634 S Ii:2:005:1 -115:1 64 <
ffff9f9f6edd4240 905435993 S Io:2:005:1 -115:1 64 = 00a20005 00000000 00000000 00000000 00000000 00000000 00000000 00000000
ffff9f9f6edd4240 905437308 C Io:2:005:1 0:1 64 >
ffff9f9f709b2540 905461276 C Ii:2:005:1 0:1 64 = c1029e02 c002c20b 00000000 00000000 00000000 00000000 00000000 00000000
ffff9f9f709b2540 905461554 S Ii:2:005:1 -115:1 64 <
ffff9f9f46c58600 905578055 S Io:2:005:1 -115:1 64 = 00a20005 00000000 00000000 00000000 00000000 00000000 00000000 00000000
ffff9f9f46c58600 905579291 C Io:2:005:1 0:1 64 >
ffff9f9f709b2540 905603332 C Ii:2:005:1 0:1 64 = cc02ac02 cb02c30b 00000000 00000000 00000000 00000000 00000000 00000000
ffff9f9f46c58600 905605622 S Ii:2:005:1 -115:1 64 <
ffff9f9f6aca4000 905720818 S Io:2:005:1 -115:1 64 = 00a20005 00000000 00000000 00000000 00000000 00000000 00000000 00000000
ffff9f9f6aca4000 905722331 C Io:2:005:1 0:1 64 >
ffff9f9f46c58600 905746307 C Ii:2:005:1 0:1 64 = d902b702 d702c40b 00000000 00000000 00000000 00000000 00000000 00000000
ffff9f9f6aca4600 905748221 S Ii:2:005:1 -115:1 64 <
ffff9f9f709b23c0 905863290 S Io:2:005:1 -115:1 64 = 00a20005 00000000 00000000 00000000 00000000 00000000 00000000 00000000
ffff9f9f709b23c0 905864250 C Io:2:005:1 0:1 64 >
ffff9f9f6aca4600 905888335 C Ii:2:005:1 0:1 64 = e602c202 e702c60b 00000000 00000000 00000000 00000000 00000000 00000000
ffff9f9f6aca4600 905888643 S Ii:2:005:1 -115:1 64 <
ffff9f9f6aca49c0 906004809 S Io:2:005:1 -115:1 64 = 00a20005 00000000 00000000 00000000 00000000 00000000 00000000 00000000
ffff9f9f6aca49c0 906006250 C Io:2:005:1 0:1 64 >
ffff9f9f6aca4600 906030335 C Ii:2:005:1 0:1 64 = f002ce02 f202c70b 00000000 00000000 00000000 00000000 00000000 00000000
ffff9f9f6bd54b40 906032783 S Ii:2:005:1 -115:1 64 <
ffff9f9f6edd4240 906147670 S Io:2:005:1 -115:1 64 = 00a20005 00000000 00000000 00000000 00000000 00000000 00000000 00000000
ffff9f9f6edd4240 906148282 C Io:2:005:1 0:1 64 >
ffff9f9f6bd54b40 906172262 C Ii:2:005:1 0:1 64 = fc02d902 fe02c90b 00000000 00000000 00000000 00000000 00000000 00000000
ffff9f9ecd10e600 906172467 S Ii:2:005:1 -115:1 64 <


