ffff9f9e1991e900 1992991242 S Io:2:005:1 -115:1 64 = 00d00701 00000000 00000000 00000000 00000000 00000000 00000000 00000000
ffff9f9e1991e900 1992991929 C Io:2:005:1 0:1 64 >
ffff9f9e1991e840 1992992936 C Ii:2:005:1 0:1 64 = 01d00701 00000000 00000000 00000000 00000000 00000000 00000000 00000000
ffff9f9dff82f780 1992993145 S Ii:2:005:1 -115:1 64 <
ffff9f9f44c52180 2011190494 S Io:2:005:1 -115:1 64 = 00d00601 00000000 00000000 00000000 00000000 00000000 00000000 00000000
ffff9f9f44c52180 2011191121 C Io:2:005:1 0:1 64 >
ffff9f9dff82f780 2011192084 C Ii:2:005:1 0:1 64 = 01d00601 00000000 00000000 00000000 00000000 00000000 00000000 00000000
ffff9f9f2006eb40 2011193003 S Ii:2:005:1 -115:1 64 <
ffff9f9dff82f6c0 2012313562 S Io:2:005:1 -115:1 64 = 00d00501 00000000 00000000 00000000 00000000 00000000 00000000 00000000
ffff9f9dff82f6c0 2012314139 C Io:2:005:1 0:1 64 >
ffff9f9f2006eb40 2012315131 C Ii:2:005:1 0:1 64 = 01d00501 00000000 00000000 00000000 00000000 00000000 00000000 00000000
ffff9f9f2006eb40 2012315372 S Ii:2:005:1 -115:1 64 <
ffff9f9f2006e0c0 2013536542 S Io:2:005:1 -115:1 64 = 00d00401 00000000 00000000 00000000 00000000 00000000 00000000 00000000
ffff9f9f2006e0c0 2013537124 C Io:2:005:1 0:1 64 >
ffff9f9f2006eb40 2013538108 C Ii:2:005:1 0:1 64 = 01d00401 00000000 00000000 00000000 00000000 00000000 00000000 00000000
ffff9f9dff82f0c0 2013538261 S Ii:2:005:1 -115:1 64 <
ffff9f9e1991e180 2014597952 S Io:2:005:1 -115:1 64 = 00d00301 00000000 00000000 00000000 00000000 00000000 00000000 00000000
ffff9f9e1991e180 2014599160 C Io:2:005:1 0:1 64 >
ffff9f9dff82f0c0 2014600125 C Ii:2:005:1 0:1 64 = 01d00301 00000000 00000000 00000000 00000000 00000000 00000000 00000000
ffff9f9e1991e180 2014601171 S Ii:2:005:1 -115:1 64 <
ffff9f9dff82f900 2015782618 S Io:2:005:1 -115:1 64 = 00d00201 00000000 00000000 00000000 00000000 00000000 00000000 00000000
ffff9f9dff82f900 2015784166 C Io:2:005:1 0:1 64 >
ffff9f9e1991e180 2015785160 C Ii:2:005:1 0:1 64 = 01d00201 00000000 00000000 00000000 00000000 00000000 00000000 00000000
ffff9f9dff82fcc0 2015785875 S Ii:2:005:1 -115:1 64 <
ffff9f9f2006e0c0 2016845722 S Io:2:005:1 -115:1 64 = 00d00101 00000000 00000000 00000000 00000000 00000000 00000000 00000000
ffff9f9f2006e0c0 2016847178 C Io:2:005:1 0:1 64 >
ffff9f9dff82fcc0 2016848162 C Ii:2:005:1 0:1 64 = 01d00101 00000000 00000000 00000000 00000000 00000000 00000000 00000000
ffff9f9f2006e0c0 2016848960 S Ii:2:005:1 -115:1 64 <
ffff9f9f2006ec00 2018898328 S Io:2:005:1 -115:1 64 = 00d00001 00000000 00000000 00000000 00000000 00000000 00000000 00000000
ffff9f9f2006ec00 2018899199 C Io:2:005:1 0:1 64 >
ffff9f9f2006e0c0 2018900225 C Ii:2:005:1 0:1 64 = 01d00001 00000000 00000000 00000000 00000000 00000000 00000000 00000000
ffff9f9f44c52300 2018900478 S Ii:2:005:1 -115:1 64 <
ffff9f9f2006e900 2021388565 S Io:2:005:1 -115:1 64 = 00d00700 00000000 00000000 00000000 00000000 00000000 00000000 00000000
ffff9f9f2006e900 2021389223 C Io:2:005:1 0:1 64 >
ffff9f9f44c52300 2021390202 C Ii:2:005:1 0:1 64 = 01d00700 00000000 00000000 00000000 00000000 00000000 00000000 00000000
ffff9f9dff82f0c0 2021390364 S Ii:2:005:1 -115:1 64 <
ffff9f9e1991e840 2023476737 S Io:2:005:1 -115:1 64 = 00d00600 00000000 00000000 00000000 00000000 00000000 00000000 00000000
ffff9f9e1991e840 2023478258 C Io:2:005:1 0:1 64 >
ffff9f9dff82f0c0 2023479198 C Ii:2:005:1 0:1 64 = 01d00600 00000000 00000000 00000000 00000000 00000000 00000000 00000000
ffff9f9dff82f0c0 2023479997 S Ii:2:005:1 -115:1 64 <
ffff9f9dff82fc00 2024620497 S Io:2:005:1 -115:1 64 = 00d00500 00000000 00000000 00000000 00000000 00000000 00000000 00000000
ffff9f9dff82fc00 2024621237 C Io:2:005:1 0:1 64 >
ffff9f9dff82f0c0 2024622249 C Ii:2:005:1 0:1 64 = 01d00500 00000000 00000000 00000000 00000000 00000000 00000000 00000000
ffff9f9dff82f0c0 2024622535 S Ii:2:005:1 -115:1 64 <
ffff9f9f2006ea80 2025984493 S Io:2:005:1 -115:1 64 = 00d00400 00000000 00000000 00000000 00000000 00000000 00000000 00000000
ffff9f9f2006ea80 2025985244 C Io:2:005:1 0:1 64 >
ffff9f9dff82f0c0 2025986249 C Ii:2:005:1 0:1 64 = 01d00400 00000000 00000000 00000000 00000000 00000000 00000000 00000000
ffff9f9f44c52d80 2025986450 S Ii:2:005:1 -115:1 64 <
ffff9f9e1991e840 2026988472 S Io:2:005:1 -115:1 64 = 00d00300 00000000 00000000 00000000 00000000 00000000 00000000 00000000
ffff9f9e1991e840 2026989240 C Io:2:005:1 0:1 64 >
ffff9f9f44c52d80 2026990237 C Ii:2:005:1 0:1 64 = 01d00300 00000000 00000000 00000000 00000000 00000000 00000000 00000000
ffff9f9e1991e300 2026990534 S Ii:2:005:1 -115:1 64 <
ffff9f9dff82fc00 2027989887 S Io:2:005:1 -115:1 64 = 00d00200 00000000 00000000 00000000 00000000 00000000 00000000 00000000
ffff9f9dff82fc00 2027991246 C Io:2:005:1 0:1 64 >
ffff9f9e1991e300 2027992247 C Ii:2:005:1 0:1 64 = 01d00200 00000000 00000000 00000000 00000000 00000000 00000000 00000000
ffff9f9f44c52000 2027993125 S Ii:2:005:1 -115:1 64 <
ffff9f9f2006e000 2029032644 S Io:2:005:1 -115:1 64 = 00d00100 00000000 00000000 00000000 00000000 00000000 00000000 00000000
ffff9f9f2006e000 2029033281 C Io:2:005:1 0:1 64 >
ffff9f9f44c52000 2029034286 C Ii:2:005:1 0:1 64 = 01d00100 00000000 00000000 00000000 00000000 00000000 00000000 00000000
ffff9f9f2006e000 2029034518 S Ii:2:005:1 -115:1 64 <
ffff9f9f2006ee40 2030838585 S Io:2:005:1 -115:1 64 = 00d00000 00000000 00000000 00000000 00000000 00000000 00000000 00000000
ffff9f9f2006ee40 2030839347 C Io:2:005:1 0:1 64 >
ffff9f9f2006e000 2030840270 C Ii:2:005:1 0:1 64 = 01d00000 00000000 00000000 00000000 00000000 00000000 00000000 00000000
ffff9f9f44c52840 2030840499 S Ii:2:005:1 -115:1 64 <
