ffff9f9f2006e000 1947649843 S Io:2:005:1 -115:1 64 = 00d10000 00000000 00000000 00000000 00000000 00000000 00000000 00000000
ffff9f9f2006e000 1947650567 C Io:2:005:1 0:1 64 >
ffff9f9e454d3c00 1947651506 C Ii:2:005:1 0:1 64 = 00d10000 00000000 00000000 00000000 00000000 00000000 00000000 00000000
ffff9f9e454d3c00 1947651769 S Ii:2:005:1 -115:1 64 <
ffff9f9e454d39c0 1947655235 S Io:2:005:1 -115:1 64 = 00d10100 00000000 00000000 00000000 00000000 00000000 00000000 00000000
ffff9f9e454d39c0 1947656480 C Io:2:005:1 0:1 64 >
ffff9f9e454d3c00 1947657478 C Ii:2:005:1 0:1 64 = 00d10100 00000000 00000000 00000000 00000000 00000000 00000000 00000000
ffff9f9e454d3c00 1947658503 S Ii:2:005:1 -115:1 64 <
ffff9f9e454d39c0 1947660731 S Io:2:005:1 -115:1 64 = 00d10200 00000000 00000000 00000000 00000000 00000000 00000000 00000000
ffff9f9e454d39c0 1947661505 C Io:2:005:1 0:1 64 >
ffff9f9e454d3c00 1947662508 C Ii:2:005:1 0:1 64 = 00d10200 00000000 00000000 00000000 00000000 00000000 00000000 00000000
ffff9f9f44c526c0 1947662762 S Ii:2:005:1 -115:1 64 <
ffff9f9f44c52300 1947666093 S Io:2:005:1 -115:1 64 = 00d10300 00000000 00000000 00000000 00000000 00000000 00000000 00000000
ffff9f9f44c52300 1947667508 C Io:2:005:1 0:1 64 >
ffff9f9f44c526c0 1947668497 C Ii:2:005:1 0:1 64 = 00d10300 00000000 00000000 00000000 00000000 00000000 00000000 00000000
ffff9f9f2006e480 1947669287 S Ii:2:005:1 -115:1 64 <
ffff9f9f2006ee40 1947671532 S Io:2:005:1 -115:1 64 = 00d10400 00000000 00000000 00000000 00000000 00000000 00000000 00000000
ffff9f9f2006ee40 1947672483 C Io:2:005:1 0:1 64 >
ffff9f9f2006e480 1947673525 C Ii:2:005:1 0:1 64 = 00d10400 00000000 00000000 00000000 00000000 00000000 00000000 00000000
ffff9f9e454d3c00 1947674813 S Ii:2:005:1 -115:1 64 <
ffff9f9f2006ec00 1947676979 S Io:2:005:1 -115:1 64 = 00d10500 00000000 00000000 00000000 00000000 00000000 00000000 00000000
ffff9f9f2006ec00 1947678487 C Io:2:005:1 0:1 64 >
ffff9f9e454d3c00 1947679485 C Ii:2:005:1 0:1 64 = 00d10500 00000000 00000000 00000000 00000000 00000000 00000000 00000000
ffff9f9f2006ec00 1947680210 S Ii:2:005:1 -115:1 64 <
ffff9f9e454d39c0 1947688793 S Io:2:005:1 -115:1 64 = 00d10600 00000000 00000000 00000000 00000000 00000000 00000000 00000000
ffff9f9e454d39c0 1947689486 C Io:2:005:1 0:1 64 >
ffff9f9f2006ec00 1947690478 C Ii:2:005:1 0:1 64 = 00d10600 00000000 00000000 00000000 00000000 00000000 00000000 00000000
ffff9f9f44c520c0 1947690664 S Ii:2:005:1 -115:1 64 <
ffff9f9f44c52c00 1947692834 S Io:2:005:1 -115:1 64 = 00d10700 00000000 00000000 00000000 00000000 00000000 00000000 00000000
ffff9f9f44c52c00 1947693502 C Io:2:005:1 0:1 64 >
ffff9f9f44c520c0 1947694475 C Ii:2:005:1 0:1 64 = 00d10700 00000000 00000000 00000000 00000000 00000000 00000000 00000000
ffff9f9f2006e600 1947694629 S Ii:2:005:1 -115:1 64 <
ffff9f9f2006e9c0 1948715823 S Io:2:005:1 -115:1 64 = 00d10000 00000000 00000000 00000000 00000000 00000000 00000000 00000000
ffff9f9f2006e9c0 1948716501 C Io:2:005:1 0:1 64 >
ffff9f9f2006e600 1948717546 C Ii:2:005:1 0:1 64 = 00d10000 00000000 00000000 00000000 00000000 00000000 00000000 00000000
ffff9f9f2006e600 1948717723 S Ii:2:005:1 -115:1 64 <
ffff9f9e1991e900 1948720154 S Io:2:005:1 -115:1 64 = 00d10100 00000000 00000000 00000000 00000000 00000000 00000000 00000000
ffff9f9e1991e900 1948721524 C Io:2:005:1 0:1 64 >
ffff9f9f2006e600 1948722488 C Ii:2:005:1 0:1 64 = 00d10100 00000000 00000000 00000000 00000000 00000000 00000000 00000000
ffff9f9e1991e840 1948723405 S Ii:2:005:1 -115:1 64 <
ffff9f9e1991e780 1948725595 S Io:2:005:1 -115:1 64 = 00d10200 00000000 00000000 00000000 00000000 00000000 00000000 00000000
ffff9f9e1991e780 1948726509 C Io:2:005:1 0:1 64 >
ffff9f9e1991e840 1948727525 C Ii:2:005:1 0:1 64 = 00d10200 00000000 00000000 00000000 00000000 00000000 00000000 00000000
ffff9f9e1991e180 1948728860 S Ii:2:005:1 -115:1 64 <
ffff9f9e1991e300 1948730987 S Io:2:005:1 -115:1 64 = 00d10300 00000000 00000000 00000000 00000000 00000000 00000000 00000000
ffff9f9e1991e300 1948732514 C Io:2:005:1 0:1 64 >
ffff9f9e1991e180 1948733491 C Ii:2:005:1 0:1 64 = 00d10300 00000000 00000000 00000000 00000000 00000000 00000000 00000000
ffff9f9e1991e180 1948734232 S Ii:2:005:1 -115:1 64 <
ffff9f9e1991e300 1948736414 S Io:2:005:1 -115:1 64 = 00d10400 00000000 00000000 00000000 00000000 00000000 00000000 00000000
ffff9f9e1991e300 1948737510 C Io:2:005:1 0:1 64 >
ffff9f9e1991e180 1948738499 C Ii:2:005:1 0:1 64 = 00d10400 00000000 00000000 00000000 00000000 00000000 00000000 00000000
ffff9f9e1991e840 1948739743 S Ii:2:005:1 -115:1 64 <
ffff9f9e454d39c0 1948740881 S Io:2:005:1 -115:1 64 = 00d10500 00000000 00000000 00000000 00000000 00000000 00000000 00000000
ffff9f9e454d39c0 1948741490 C Io:2:005:1 0:1 64 >
ffff9f9e1991e840 1948742487 C Ii:2:005:1 0:1 64 = 00d10500 00000000 00000000 00000000 00000000 00000000 00000000 00000000
ffff9f9f44c52c00 1948745849 S Ii:2:005:1 -115:1 64 <
ffff9f9f44c52180 1948748040 S Io:2:005:1 -115:1 64 = 00d10600 00000000 00000000 00000000 00000000 00000000 00000000 00000000
ffff9f9f44c52180 1948750523 C Io:2:005:1 0:1 64 >
ffff9f9f44c52c00 1948751487 C Ii:2:005:1 0:1 64 = 00d10600 00000000 00000000 00000000 00000000 00000000 00000000 00000000
ffff9f9e454d3900 1948752339 S Ii:2:005:1 -115:1 64 <
ffff9f9e454d3f00 1948754514 S Io:2:005:1 -115:1 64 = 00d10700 00000000 00000000 00000000 00000000 00000000 00000000 00000000
ffff9f9e454d3f00 1948755520 C Io:2:005:1 0:1 64 >
ffff9f9e454d3900 1948756483 C Ii:2:005:1 0:1 64 = 00d10700 00000000 00000000 00000000 00000000 00000000 00000000 00000000
ffff9f9e454d3f00 1948758788 S Ii:2:005:1 -115:1 64 <

